{
  "schema": "f4-hybrid-diagnostic-v1",
  "experiment": "F4",
  "run_id": "foundation-f4-hybrid-audit-20260818",
  "condition": "unpinned",
  "client_mode": "native",
  "order_index": 1,
  "model_order": [
    "hybrid",
    "async",
    "sync"
  ],
  "process_affinity": [
    0,
    1,
    2,
    3,
    4,
    5,
    6,
    7,
    8,
    9,
    10,
    11,
    12,
    13,
    14,
    15
  ],
  "available_workers": 4,
  "server_queue_capacity": 8,
  "warmups": 2,
  "samples": 10,
  "service_requests": 64,
  "remote_requests": 32,
  "binary_size_bytes": 5876840,
  "clean_build_time_ms": 47337.0,
  "models": [
    {
      "model": "hybrid",
      "order_index": 0,
      "configured_thread_count": 6,
      "runtime_thread_count": 2,
      "server_worker_count": 4,
      "client_concurrency": 8,
      "workloads": [
        {
          "workload": "service",
          "requests": 64,
          "delay_us": 2000,
          "warmups": 2,
          "samples": [
            {
              "sample": 0,
              "elapsed_us": 36485.789,
              "rps": 1754.1076061148083,
              "expected_requests": 64,
              "client_completed": 64,
              "server_completed": 64,
              "client_errors": 0,
              "server_errors": 0,
              "client_max_active": 8,
              "server_max_active": 4,
              "client_max_queue": 8,
              "server_max_queue": 4,
              "client_workers": 8,
              "server_workers": 4
            },
            {
              "sample": 1,
              "elapsed_us": 39033.456,
              "rps": 1639.6191000868587,
              "expected_requests": 64,
              "client_completed": 64,
              "server_completed": 64,
              "client_errors": 0,
              "server_errors": 0,
              "client_max_active": 8,
              "server_max_active": 4,
              "client_max_queue": 8,
              "server_max_queue": 4,
              "client_workers": 8,
              "server_workers": 4
            },
            {
              "sample": 2,
              "elapsed_us": 36132.177,
              "rps": 1771.2743962258348,
              "expected_requests": 64,
              "client_completed": 64,
              "server_completed": 64,
              "client_errors": 0,
              "server_errors": 0,
              "client_max_active": 8,
              "server_max_active": 4,
              "client_max_queue": 8,
              "server_max_queue": 4,
              "client_workers": 8,
              "server_workers": 4
            },
            {
              "sample": 3,
              "elapsed_us": 36400.136,
              "rps": 1758.2351890113816,
              "expected_requests": 64,
              "client_completed": 64,
              "server_completed": 64,
              "client_errors": 0,
              "server_errors": 0,
              "client_max_active": 8,
              "server_max_active": 4,
              "client_max_queue": 8,
              "server_max_queue": 4,
              "client_workers": 8,
              "server_workers": 4
            },
            {
              "sample": 4,
              "elapsed_us": 36340.473,
              "rps": 1761.121821391813,
              "expected_requests": 64,
              "client_completed": 64,
              "server_completed": 64,
              "client_errors": 0,
              "server_errors": 0,
              "client_max_active": 8,
              "server_max_active": 4,
              "client_max_queue": 8,
              "server_max_queue": 4,
              "client_workers": 8,
              "server_workers": 4
            },
            {
              "sample": 5,
              "elapsed_us": 37260.951,
              "rps": 1717.6158493646606,
              "expected_requests": 64,
              "client_completed": 64,
              "server_completed": 64,
              "client_errors": 0,
              "server_errors": 0,
              "client_max_active": 8,
              "server_max_active": 4,
              "client_max_queue": 8,
              "server_max_queue": 4,
              "client_workers": 8,
              "server_workers": 4
            },
            {
              "sample": 6,
              "elapsed_us": 37066.211,
              "rps": 1726.6399309063447,
              "expected_requests": 64,
              "client_completed": 64,
              "server_completed": 64,
              "client_errors": 0,
              "server_errors": 0,
              "client_max_active": 8,
              "server_max_active": 4,
              "client_max_queue": 8,
              "server_max_queue": 4,
              "client_workers": 8,
              "server_workers": 4
            },
            {
              "sample": 7,
              "elapsed_us": 36485.198000000004,
              "rps": 1754.136019763412,
              "expected_requests": 64,
              "client_completed": 64,
              "server_completed": 64,
              "client_errors": 0,
              "server_errors": 0,
              "client_max_active": 8,
              "server_max_active": 4,
              "client_max_queue": 8,
              "server_max_queue": 4,
              "client_workers": 8,
              "server_workers": 4
            },
            {
              "sample": 8,
              "elapsed_us": 36087.070999999996,
              "rps": 1773.4883498857528,
              "expected_requests": 64,
              "client_completed": 64,
              "server_completed": 64,
              "client_errors": 0,
              "server_errors": 0,
              "client_max_active": 8,
              "server_max_active": 4,
              "client_max_queue": 8,
              "server_max_queue": 4,
              "client_workers": 8,
              "server_workers": 4
            },
            {
              "sample": 9,
              "elapsed_us": 36382.092,
              "rps": 1759.1072003226204,
              "expected_requests": 64,
              "client_completed": 64,
              "server_completed": 64,
              "client_errors": 0,
              "server_errors": 0,
              "client_max_active": 8,
              "server_max_active": 4,
              "client_max_queue": 8,
              "server_max_queue": 4,
              "client_workers": 8,
              "server_workers": 4
            }
          ],
          "rps_samples": [
            1754.1076061148083,
            1639.6191000868587,
            1771.2743962258348,
            1758.2351890113816,
            1761.121821391813,
            1717.6158493646606,
            1726.6399309063447,
            1754.136019763412,
            1773.4883498857528,
            1759.1072003226204
          ],
          "p50": 1758.2351890113816,
          "p95": 1773.4883498857528,
          "max": 1773.4883498857528
        },
        {
          "workload": "remote",
          "requests": 32,
          "delay_us": 8000,
          "warmups": 2,
          "samples": [
            {
              "sample": 0,
              "elapsed_us": 66647.67000000001,
              "rps": 480.1368149854301,
              "expected_requests": 32,
              "client_completed": 32,
              "server_completed": 32,
              "client_errors": 0,
              "server_errors": 0,
              "client_max_active": 8,
              "server_max_active": 4,
              "client_max_queue": 8,
              "server_max_queue": 4,
              "client_workers": 8,
              "server_workers": 4
            },
            {
              "sample": 1,
              "elapsed_us": 66508.886,
              "rps": 481.1387158100949,
              "expected_requests": 32,
              "client_completed": 32,
              "server_completed": 32,
              "client_errors": 0,
              "server_errors": 0,
              "client_max_active": 8,
              "server_max_active": 4,
              "client_max_queue": 8,
              "server_max_queue": 4,
              "client_workers": 8,
              "server_workers": 4
            },
            {
              "sample": 2,
              "elapsed_us": 66986.84300000001,
              "rps": 477.70574887370043,
              "expected_requests": 32,
              "client_completed": 32,
              "server_completed": 32,
              "client_errors": 0,
              "server_errors": 0,
              "client_max_active": 8,
              "server_max_active": 4,
              "client_max_queue": 8,
              "server_max_queue": 4,
              "client_workers": 8,
              "server_workers": 4
            },
            {
              "sample": 3,
              "elapsed_us": 68085.981,
              "rps": 469.9939624869325,
              "expected_requests": 32,
              "client_completed": 32,
              "server_completed": 32,
              "client_errors": 0,
              "server_errors": 0,
              "client_max_active": 8,
              "server_max_active": 4,
              "client_max_queue": 8,
              "server_max_queue": 6,
              "client_workers": 8,
              "server_workers": 4
            },
            {
              "sample": 4,
              "elapsed_us": 66456.848,
              "rps": 481.5154639895049,
              "expected_requests": 32,
              "client_completed": 32,
              "server_completed": 32,
              "client_errors": 0,
              "server_errors": 0,
              "client_max_active": 8,
              "server_max_active": 4,
              "client_max_queue": 8,
              "server_max_queue": 4,
              "client_workers": 8,
              "server_workers": 4
            },
            {
              "sample": 5,
              "elapsed_us": 66458.901,
              "rps": 481.50058936424483,
              "expected_requests": 32,
              "client_completed": 32,
              "server_completed": 32,
              "client_errors": 0,